{
  "ticker": "AAPL",
  "market": "US",
  "data_mode": "enhanced",
  "output_mode": "C",
  "output_language": "en",
  "analysis_date": "2026-03-28",
  "company_type": "Technology/Platform",
  "peer_tickers": ["MSFT", "GOOGL", "META", "AMZN"],
  "analysis_framework_path": "references/analysis-framework-dashboard.md",
  "tier1_calls": [
    "get_income_statements",
    "get_balance_sheets",
    "get_cash_flow_statements",
    "get_current_stock_price",
    "get_financial_metrics",
    "get_analyst_estimates",
    "get_company_news",
    "get_sec_filings"
  ],
  "tier2_searches": [
    "\"AAPL\" earnings call transcript guidance 2026",
    "\"Apple\" industry trends competitive landscape 2026",
    "\"AAPL\" recent news developments last 90 days"
  ],
  "tier2_fetches": [
    "https://finance.yahoo.com/quote/AAPL/"
  ],
  "macro_search_required": true,
  "macro_search": "\"Technology\" macro risk factors economic outlook 2026",
  "macro_factors": ["interest rates", "consumer spending", "USD strength"],
  "run_context": {
    "run_id": "20260328T000000Z_AAPL_C",
    "ticker": "AAPL",
    "artifact_root": "output/runs/20260328T000000Z_AAPL_C/AAPL",
    "reports_dir": "output/reports",
    "compatibility_mirror_enabled": false
  }
}
